{"canvas_m":{"height":0.06,"width":0.06},"content_sha256":"d0206b57daed50b31b42067ec5006e02e608362e8bf6502f8ec46397fcc742e3","inks":[{"color_srgb":[0,0,0],"id":"black"}],"layers":[{"elements":[{"closed":false,"deposition":0.45,"fill":false,"id":"field","kind":"stipple","points_m":[[0.015,0.015],[0.03,0.012],[0.045,0.015],[0.02,0.03],[0.04,0.03],[0.03,0.045]],"width_m":0.0012}],"id":"dots","ink_id":"black"}],"negative_space_masks":[],"preview_sha256":"14a5ad8a2b49750e8c927cdbb4d8f7ae670511deafc0de39e319ec4e7d2a23d2","provenance":{"created_utc":"2026-09-04T13:00:00Z","producer":"tatbot-human-representation-examples","seed":9042026,"source_sha256":"f9e4ebaa637c1cf0b7fc3e3b66c1025a415ef4376a07e1762279178ebfcbd502","version":"1"},"schema":"tatbot.tattoo-program/1","semantic_intent":"Synthetic stipple contract fixture; no person data."}
