{
  "canvas_m": {
    "height": 0.05,
    "width": 0.08
  },
  "content_sha256": "0cc57177c20be9df1584f2581f718e0aba6e76c3e20f55e2c9925ec1c0b0091e",
  "inks": [
    {
      "color_srgb": [
        0,
        0,
        0
      ],
      "id": "black"
    },
    {
      "color_srgb": [
        0.05,
        0.2,
        0.8
      ],
      "id": "blue"
    }
  ],
  "layers": [
    {
      "elements": [
        {
          "closed": false,
          "deposition": 0.7,
          "fill": false,
          "id": "line-1",
          "kind": "path",
          "points_m": [
            [
              0.005,
              0.005
            ],
            [
              0.03,
              0.02
            ],
            [
              0.06,
              0.01
            ]
          ],
          "width_m": 0.0008
        },
        {
          "closed": false,
          "control_points_m": [
            [
              0.01,
              0.035
            ],
            [
              0.025,
              0.048
            ],
            [
              0.055,
              0.045
            ],
            [
              0.07,
              0.03
            ]
          ],
          "deposition": 0.65,
          "fill": false,
          "id": "curve-1",
          "kind": "cubic_bezier",
          "width_m": 0.0006
        },
        {
          "closed": true,
          "deposition": 1.0,
          "fill": true,
          "id": "region-1",
          "kind": "region",
          "points_m": [
            [
              0.02,
              0.025
            ],
            [
              0.035,
              0.04
            ],
            [
              0.05,
              0.025
            ]
          ],
          "width_m": 0.0008
        }
      ],
      "id": "black-artwork",
      "ink_id": "black"
    },
    {
      "elements": [
        {
          "closed": false,
          "deposition": 0.45,
          "fill": false,
          "id": "stipple-1",
          "kind": "stipple",
          "points_m": [
            [
              0.015,
              0.015
            ],
            [
              0.018,
              0.016
            ],
            [
              0.021,
              0.015
            ]
          ],
          "width_m": 0.0005
        }
      ],
      "id": "blue-stipple",
      "ink_id": "blue"
    }
  ],
  "negative_space_masks": [
    {
      "id": "mask-1",
      "points_m": [
        [
          0.03,
          0.027
        ],
        [
          0.035,
          0.034
        ],
        [
          0.04,
          0.027
        ]
      ]
    }
  ],
  "preview_sha256": "46224ef99027389850cc53a11d68977f729bb130dfe0d0acd6a3b1824c2acb81",
  "provenance": {
    "created_utc": "2026-09-04T01:09:37Z",
    "producer": "tatbot-human-representation-artwork-matrix",
    "seed": 17,
    "source_sha256": "a4c71d043bc7eff3c8e2efc77667b791963c075b3e387ef208713ccd425b899a",
    "version": "1"
  },
  "schema": "tatbot.tattoo-program/1",
  "semantic_intent": "Synthetic line, cubic curve, closed blackwork fill, stipple, negative-space, and multi-color fixture; no person data."
}
