{"canvas_m":{"height":0.06,"width":0.06},"content_sha256":"b34b835936cbf5d055b61749eb360e1b4fb71947dfec825bd032d62f6d2eb620","inks":[{"color_srgb":[0,0,0],"id":"black"}],"layers":[{"elements":[{"closed":true,"deposition":1,"fill":true,"id":"diamond","kind":"region","points_m":[[0.03,0.006],[0.054,0.03],[0.03,0.054],[0.006,0.03]],"width_m":0.0008}],"id":"fill","ink_id":"black"}],"negative_space_masks":[{"id":"center-cutout","points_m":[[0.03,0.02],[0.04,0.03],[0.03,0.04],[0.02,0.03]]}],"preview_sha256":"9ea7a98e78b1643d38ca623ec9c977f1e126a712abb61e0237d1ada02b10074b","provenance":{"created_utc":"2026-09-04T13:00:00Z","producer":"tatbot-human-representation-examples","seed":9042026,"source_sha256":"458fa7b606f91b4b8e31189a4eaf1253008c5c1a38d0369986e9d99d5e3a4db0","version":"1"},"schema":"tatbot.tattoo-program/1","semantic_intent":"Synthetic blackwork contract fixture; no person data."}
