{"canvas_m":{"height":0.06,"width":0.06},"content_sha256":"12091e8de707afd772b213d996f447760fff955861cd57720479b27aa5ce6793","inks":[{"color_srgb":[0,0,0],"id":"black"}],"layers":[{"elements":[{"closed":false,"deposition":0.7,"fill":false,"id":"line","kind":"path","points_m":[[0.008,0.012],[0.022,0.045],[0.052,0.018]],"width_m":0.0008},{"closed":false,"control_points_m":[[0.01,0.05],[0.02,0.02],[0.04,0.02],[0.05,0.05]],"deposition":0.7,"fill":false,"id":"curve","kind":"cubic_bezier","width_m":0.0008}],"id":"lines","ink_id":"black"}],"negative_space_masks":[],"preview_sha256":"0133f04083e9bc7fd176c886897406d41c0eb1c7c5ea0aabd5ce2277ce152072","provenance":{"created_utc":"2026-09-04T13:00:00Z","producer":"tatbot-human-representation-examples","seed":9042026,"source_sha256":"0eb6a5acdabdd7e44f512c8c2c42b29da2e5fd2ff3320695797594fe8154c4cc","version":"1"},"schema":"tatbot.tattoo-program/1","semantic_intent":"Synthetic linework contract fixture; no person data."}
