{"canvas_m":{"height":0.06,"width":0.06},"content_sha256":"6a7acb47c58f1c3365a055d93b518e7fa9f0303f80349d9b4debf7516e3796d9","inks":[{"color_srgb":[0.75,0.05,0.04],"id":"red"},{"color_srgb":[0.03,0.18,0.8],"id":"blue"}],"layers":[{"elements":[{"closed":false,"deposition":0.7,"fill":false,"id":"red-wave","kind":"path","points_m":[[0.006,0.02],[0.02,0.04],[0.035,0.02],[0.052,0.04]],"width_m":0.0008}],"id":"red-lines","ink_id":"red"},{"elements":[{"closed":true,"deposition":0.9,"fill":true,"id":"blue-triangle","kind":"region","points_m":[[0.018,0.01],[0.042,0.01],[0.03,0.032]],"width_m":0.0008}],"id":"blue-region","ink_id":"blue"}],"negative_space_masks":[],"preview_sha256":"efde27cf01f625701bf05e3dbb0dd98bc8d80e90a105d60b65cd2ea81546e455","provenance":{"created_utc":"2026-09-04T13:00:00Z","producer":"tatbot-human-representation-examples","seed":9042026,"source_sha256":"e78a769c16bc91a8da70985d35811f9e8f6c645987ad444a2dfe6dd152874afe","version":"1"},"schema":"tatbot.tattoo-program/1","semantic_intent":"Synthetic multi-color contract fixture; no person data."}
